{
  "id": 5,
  "name": "Firefly Marsh",
  "width": 3060,
  "height": 600,
  "playerStart": {
    "x": 90,
    "y": 430
  },
  "platforms": [
    {
      "x": 0,
      "y": 500,
      "w": 480,
      "h": 100,
      "type": "ground"
    },
    {
      "x": 580,
      "y": 500,
      "w": 160,
      "h": 60,
      "type": "ground"
    },
    {
      "x": 1020,
      "y": 500,
      "w": 220,
      "h": 100,
      "type": "ground"
    },
    {
      "x": 1240,
      "y": 500,
      "w": 180,
      "h": 100,
      "type": "ground"
    },
    {
      "x": 1400,
      "y": 360,
      "w": 180,
      "h": 32,
      "type": "grass"
    },
    {
      "x": 1680,
      "y": 420,
      "w": 160,
      "h": 60,
      "type": "ground"
    },
    {
      "x": 2120,
      "y": 420,
      "w": 220,
      "h": 100,
      "type": "ground"
    },
    {
      "x": 2500,
      "y": 500,
      "w": 460,
      "h": 120,
      "type": "ground"
    }
  ],
  "lilypads": [
    {
      "x": 830,
      "y": 512
    },
    {
      "x": 930,
      "y": 508
    },
    {
      "x": 1930,
      "y": 512
    },
    {
      "x": 2030,
      "y": 508
    },
    {
      "x": 2415,
      "y": 512
    }
  ],
  "mushrooms": [
    {
      "x": 1350,
      "y": 402
    }
  ],
  "cattails": [
    {
      "x": 120,
      "y": 476
    },
    {
      "x": 420,
      "y": 476
    },
    {
      "x": 1040,
      "y": 416
    },
    {
      "x": 2140,
      "y": 336
    },
    {
      "x": 2540,
      "y": 456
    },
    {
      "x": 2900,
      "y": 456
    }
  ],
  "waterPits": [
    {
      "x": 480,
      "y": 530,
      "w": 100,
      "h": 70
    },
    {
      "x": 740,
      "y": 530,
      "w": 280,
      "h": 70
    },
    {
      "x": 1580,
      "y": 530,
      "w": 100,
      "h": 70
    },
    {
      "x": 1840,
      "y": 530,
      "w": 280,
      "h": 70
    },
    {
      "x": 2340,
      "y": 530,
      "w": 160,
      "h": 70
    }
  ],
  "fireflies": [
    {
      "x": 770.0,
      "y": 348.2
    },
    {
      "x": 800.0,
      "y": 372.2
    },
    {
      "x": 970.0,
      "y": 434.0
    },
    {
      "x": 1010.0,
      "y": 411.3
    },
    {
      "x": 1372.5,
      "y": 264.5
    },
    {
      "x": 1395.0,
      "y": 201.6
    },
    {
      "x": 1417.5,
      "y": 213.4
    },
    {
      "x": 1870.0,
      "y": 264.9
    },
    {
      "x": 1900.0,
      "y": 315.5
    }
  ],
  "goldenLotus": [
    {
      "x": 2680,
      "y": 360
    }
  ],
  "beetles": [
    {
      "x": 260,
      "y": 482,
      "patrol": 80
    },
    {
      "x": 620,
      "y": 422,
      "patrol": 60
    },
    {
      "x": 1720,
      "y": 342,
      "patrol": 60
    }
  ],
  "mosquitoes": [
    {
      "x": 1740,
      "y": 270,
      "range": 50
    }
  ],
  "goal": {
    "x": 2850,
    "y": 424
  }
}